{
  "$schema": "https://json-schema.org/draft/2020-12/schema",
  "$id": "https://local-ai-platform.local/registries/voices.schema.json",
  "title": "Kokoro voice catalog",
  "description": "Voice entries for the Kokoro TTS engine. Loaded at module import by partner/engine.py via local_ai_platform.registries.load_voice_catalog. Adding a voice = JSON edit + module re-import; no Python edit. The Flutter voice picker dropdown reads this list verbatim.",
  "type": "array",
  "minItems": 1,
  "items": {
    "type": "object",
    "additionalProperties": false,
    "required": [
      "id",
      "display_name",
      "gender",
      "language",
      "description"
    ],
    "properties": {
      "id": {
        "type": "string",
        "minLength": 1,
        "description": "Stable voice identifier (e.g. 'af_heart'). Used as the lookup key and surfaced in app_events. Must be unique across the catalog."
      },
      "display_name": {
        "type": "string",
        "minLength": 1,
        "description": "Human-friendly label shown in the Flutter voice picker."
      },
      "gender": {
        "type": "string",
        "enum": ["female", "male"],
        "description": "Voice gender. Picker UI assumes the binary set today; adding 'neutral' or another value is a deliberate update that should land alongside picker-UI changes."
      },
      "language": {
        "type": "string",
        "minLength": 2,
        "description": "BCP-47-style language tag (e.g. 'en-US', 'en-GB')."
      },
      "description": {
        "type": "string",
        "minLength": 1,
        "description": "Short prose summary shown next to the display_name in the voice picker."
      }
    }
  }
}
